title,description,source,published_at,url
BTC price to $116K next? Bitcoin trader sees 'early week' all-time high,"Key points:<ul><li>Bitcoin is convincing traders that an upside breakout is around the corner, with all-time highs in sight.
</li><li>One target demands $116,000 next week, moving BTC/USD firmly out of its narrow range.
</li><li>A quick dip before continuin…",Cointelegraph,2025-05-18T11:30:00Z,https://cointelegraph.com/news/bitcoin-due-116k-next-trader-early-week-all-time-highs
Myth or reality? MiCA and its real impact on the market debunking common misconceptions,"The following article is a guest post and opinion of Mike Romanenko, CVO & Co-founder of Kyrrex. The Markets in Crypto Assets Regulation (MiCA) seeks to protect investors and make the rules clear for European crypto companies. However, according to Mike Roman…",CryptoSlate,2025-05-18T11:00:26Z,https://cryptoslate.com/myth-or-reality-mica-and-its-real-impact-on-the-market-debunking-common-misconceptions/
What Is A Cryptocurrency ETF? A Guide For Crypto Investors Looking To Diversify,Crypto ETFs explained: A simpler way to invest in cryptocurrency. Discover the benefits and risks for investors aiming to diversify their portfolio.,Forbes,2025-05-18T11:00:00Z,https://www.forbes.com/sites/digital-assets/article/what-is-cryptocurrency-etf/
Ahead of Market: 10 things that will decide stock market action on Monday,"Indian markets ended lower on Friday due to profit booking in financial and IT stocks. Despite the dip, midcaps, smallcaps, and rate-sensitive sectors stayed strong. Optimism remains on easing global tensions and rate cut hopes. US and European markets extend…",The Times of India,2025-05-18T10:55:14Z,https://economictimes.indiatimes.com/markets/stocks/news/ahead-of-market-10-things-that-will-decide-stock-market-action-on-monday/articleshow/121248641.cms
"Ethereum Price Struggles To Hold Above $2,500 — Watch Out For This Support Level","The Ethereum price performance in the month of May has been nothing short of outstanding, surging by more than 35% in the past two weeks. After making a strong run toward the $2,700 mark on Tuesday, May 13, the altcoin’s price has struggled to build on its mo…",newsBTC,2025-05-18T10:00:16Z,http://www.newsbtc.com/news/ethereum-price-struggles-to-hold-above-2500/
"This 1 Catalyst Could Send Bitcoin Skyrocketing Higher, According to Silicon Valley Billionaire Tim Draper",,Yahoo Entertainment,2025-05-18T10:00:00Z,https://consent.yahoo.com/v2/collectConsent?sessionId=1_cc-session_17f220d7-b241-4b31-b34a-a52e23197946
‘Bitcoin Standard’ author backs funding dev to make spamming Bitcoin costly,"Economist and author of The Bitcoin Standard, Saifedean Ammous, has weighed in on the ongoing debate over spam inscriptions on the Bitcoin network, suggesting he would “throw in a few sats” to fund a full-time developer focused on making Bitcoin spamming more…",Cointelegraph,2025-05-18T09:40:57Z,https://cointelegraph.com/news/saifedean-ammous-funds-dev-to-fight-bitcoin-spam
Bitcoin STH Unrealized Profits Reach 21% – Is There Room To Grow?,"Bitcoin is trading in a narrow range between $100,000 and $105,000, sparking growing impatience among investors eager for the next major move. After weeks of bullish momentum and a sharp climb from April lows, the market has entered a phase of quiet consolida…",Bitcoinist,2025-05-18T09:00:15Z,https://bitcoinist.com/bitcoin-sth-unrealized-profits-reach-21-is-there-room-to-grow/
"Experts found rogue devices, including hidden cellular radios, in Chinese-made power inverters used worldwide",Chinese “kill switches” found in Chinese-made power inverters in US solar farm equipment that could let Beijing remotely disable power grids in a conflict. Investigators found “kill switches” in Chinese-made power inverters in US solar farm equipment. These h…,Securityaffairs.com,2025-05-18T08:52:26Z,https://securityaffairs.com/178005/hacking/rogue-devices-in-chinese-made-power-inverters-used-worldwide.html
Bitcoin Solaris Unveils Hybrid Consensus Architecture Ahead of Nova App Mining Launch,"TALLINN, Estonia, May 18, 2025 (GLOBE NEWSWIRE) -- Bitcoin Solaris is officially unveiling its advanced hybrid consensus architecture, purpose-built to support fast, decentralized applications with user-integrated mining and sub-2-second finality. This system…",GlobeNewswire,2025-05-18T08:41:00Z,https://www.globenewswire.com/news-release/2025/05/18/3083532/0/en/Bitcoin-Solaris-Unveils-Hybrid-Consensus-Architecture-Ahead-of-Nova-App-Mining-Launch.html
Retired artist loses $2M in crypto to Coinbase impersonator,"Retired artist Ed Suman lost over $2 million in cryptocurrency earlier this year after falling victim to a scam involving someone posing as a Coinbase support representative.Suman, 67, spent nearly two decades as a fabricator in the art world, helping build h…",Cointelegraph,2025-05-18T08:13:34Z,https://cointelegraph.com/news/retired-artist-loses-2m-in-crypto-to-coinbase-impersonator
Bitcoin vs USD: Why BTC is yet to catch up to the dollar for global dominance,"Bitcoin’s rise highlights growing interest in decentralised finance, but it remains far from replacing the US Dollar, which maintains global supremacy due to stability, reach, and economic might. For now, Bitcoin serves as a supplementary asset, not a replace…",The Times of India,2025-05-18T08:11:45Z,https://economictimes.indiatimes.com/markets/cryptocurrency/crypto-news/bitcoin-vs-usd-why-btc-is-yet-to-catch-up-to-the-dollar-for-global-dominance/articleshow/121247041.cms
Cardano Whale Activity Spikes – 80 Million ADA Added In 48 Hours,"Cardano (ADA) is entering a decisive moment as bulls fight to hold the $0.74 support zone and build momentum for a move toward the $0.90 level. After gaining over 68% since its April lows, ADA is showing strong signs of recovery, but it must defend current le…",newsBTC,2025-05-18T08:00:02Z,http://www.newsbtc.com/news/cardano/cardano-whale-activity-spikes-80-million-ada-added-in-48-hours/
Q4 Earnings Estimate for Iris Energy Issued By Roth Capital,"Iris Energy Limited (NASDAQ:IREN – Free Report) – Investment analysts at Roth Capital dropped their Q4 2025 earnings per share (EPS) estimates for shares of Iris Energy in a report released on Thursday, May 15th. Roth Capital analyst D. Aftahi now anticipates…",ETF Daily News,2025-05-18T07:28:45Z,https://www.etfdailynews.com/2025/05/18/q4-earnings-estimate-for-iris-energy-issued-by-roth-capital/
"Price T Rowe Associates Inc. MD Makes New Investment in CompoSecure, Inc. (NASDAQ:CMPO)","Price T Rowe Associates Inc. MD purchased a new position in shares of CompoSecure, Inc. (NASDAQ:CMPO – Free Report) during the 4th quarter, according to the company in its most recent 13F filing with the Securities and Exchange Commission. The institutional i…",ETF Daily News,2025-05-18T07:26:48Z,https://www.etfdailynews.com/2025/05/18/price-t-rowe-associates-inc-md-makes-new-investment-in-composecure-inc-nasdaqcmpo/
"Bit Digital, Inc. (NASDAQ:BTBT) Stake Boosted by Price T Rowe Associates Inc. MD","Price T Rowe Associates Inc. MD grew its stake in shares of Bit Digital, Inc. (NASDAQ:BTBT – Free Report) by 10.8% during the 4th quarter, according to the company in its most recent filing with the Securities & Exchange Commission. The institutional investor…",ETF Daily News,2025-05-18T07:22:57Z,https://www.etfdailynews.com/2025/05/18/bit-digital-inc-nasdaqbtbt-stake-boosted-by-price-t-rowe-associates-inc-md/
Cipher Mining (NASDAQ:CIFR) Shares Up 9.9% – Here’s Why,"Cipher Mining Inc. (NASDAQ:CIFR – Get Free Report)’s share price rose 9.9% during trading on Friday . The stock traded as high as $3.55 and last traded at $3.49. Approximately 3,114,676 shares were traded during trading, a decline of 77% from the average dail…",ETF Daily News,2025-05-18T07:10:57Z,https://www.etfdailynews.com/2025/05/18/cipher-mining-nasdaqcifr-shares-up-9-9-heres-why/
